title,url,source,snippet,found_date,published_at,image_url,source_group,feed_source,importance_score,importance_reason
Vil prioritera gjennomføring av prosjektet som får godkjend reguleringsplan først,https://www.hardanger-folkeblad.no/vil-prioritera-gjennomforing-av-prosjektet-som-far-godkjend-reguleringsplan-forst/s/80-22-19875,hf.no,Kvamskogen: Fylket vil ha fart på dei to rassikringsprosjekta på fylkesveg 49 — men kva av dei kjem først i køen?,2026-06-26,2026-05-11T00:00:00+00:00,https://g.acdn.no/obscura/API/dynamic/r1/cue/tr_2000_2000_s_f/1778143074000/harfol/2026/5/7/8/rundkB8yring%2520austrepollen.png?chk=2405AC,core,HF fallback,7,"Kildescore 5 for hf.no; Temaord: reguleringsplan, veg"
Vil dela ut 450 000 frå fond,https://www.hf.no/nyhende/vil-dela-ut-450-000-fra-fond/370211,hf.no,"Den største tilrådde løyvinga går til Kvamskogen Vel, som har søkt om og ser ut til å få 150 000 kroner til vidare arbeid med låglandsløypa på Kvamskogen.",2026-06-26,2026-05-02T00:00:00+00:00,,core,HF fallback,7,"Kildescore 5 for hf.no; Temaord: Kvamskogen Vel, fond"
Påske på Kvamskogen,https://news.google.com/rss/articles/CBMiiwFBVV95cUxOTzBaVllmaktRUktXcWxzWElCeGlJM09OYVhxNmZKVjBMSGVqVnIwLUJKQkZBWkRFci1Bc2ROZTZzaHFkbGc2NF90MlY1RUIzRWpzSFIxTXZWd045Mm9yVUtUem1vbk56Qi0zUUc4cy1XZHB5VWxmQkdtNVBPNFRNcXdNeWVOU2YtVG5n?oc=5,nrk.no,Påske på Kvamskogen NRK,2026-06-26,2026-03-31T07:00:00+00:00,,core,Google News RSS,5,Kildescore 5 for nrk.no
(+) Hamna i elva då bru kollapsa på Kvamskogen,https://news.google.com/rss/articles/CBMigAFBVV95cUxPWTZ3REMwdzNoRURnZG50Q1JTWWdKbENHc0JLU3RIR1VwSW05SlRPREdENV9iYy15QlhCVnZKcDYxMEZ4R21Hd1NGSlctUHFwb2lVdlBpMjlGc3pDRjhlQjVoZVZrTkFPQkdsZ3Aycndub3JfQ3RrWFlnOTYydzJHVA?oc=5,hf.no,(+) Hamna i elva då bru kollapsa på Kvamskogen Hordaland Folkeblad,2026-06-26,2026-03-30T07:00:00+00:00,,core,Google News RSS,5,Kildescore 5 for hf.no
Ny løypemelding etter at Kvamskogens preppemaskin gikk i elven,https://news.google.com/rss/articles/CBMimgFBVV95cUxPOXYzYzlRUEVfaEdiVUtKWXJZR1hYR1BGUTNjTmNFZlNJeEJtaWF1ZVF0WTRGckh5VG5DZXVOQ1k1ZVlxSDZvUkJoTjVIXzMtcl84cEFzU1NhRmZIaHkyNFR0eElPbHFkWHExeDhTbGdvdXBjWWk0YjFxOG5tc1lxM3RsX01EWkxQQ1hXVjNicHdfZDM2c25qVTJB?oc=5,ba.no,Ny løypemelding etter at Kvamskogens preppemaskin gikk i elven Bergensavisen,2026-06-26,2026-03-30T07:00:00+00:00,,core,Google News RSS,5,Kildescore 4 for ba.no; Temaord: løype
Løypemaskin ligger i elv på Kvamskogen,https://news.google.com/rss/articles/CBMihAFBVV95cUxQaEQ1Z3R4cUtLMzdSMkVEVS1fUUl0X2NnX2cxOE5BUUlMQmhPVXFhVTYwS1ZsY0JsaEJNRFV2Wld0WmZ5d2FfUEZlNlNaNnBvV1lDbW90STJ5RllFUnl1MFI0WUNOQzlvUUo1Y09tYUtNcnRiMUNIVTJBNE9JR3ZKX0w3MnQ?oc=5,bt.no,Løypemaskin ligger i elv på Kvamskogen Bergens Tidende,2026-06-26,2026-03-29T07:00:00+00:00,,core,Google News RSS,6,Kildescore 5 for bt.no; Temaord: løype
Løypemaskin havnet i elv på Kvamskogen,https://news.google.com/rss/articles/CBMiekFVX3lxTE80MFFCQVpHc0QtbGVXOUYtWF9FbFJEWFlWeUZOdmhpMXVDN0FqRzRxUVo5YjlTNHlsSkE4SEFBXzFiNDd5aG1vTE9UaGxMWkRrZjZ5NmJReWlmN1ZNVno1U3R0VW92ckdfNWRKU1hVa1hOOHluWVZQcVFB?oc=5,ba.no,Løypemaskin havnet i elv på Kvamskogen Bergensavisen,2026-06-26,2026-03-29T07:00:00+00:00,,core,Google News RSS,5,Kildescore 4 for ba.no; Temaord: løype
