title,url,source,snippet,found_date,published_at,image_url,source_group,feed_source,importance_score,importance_reason
Værvarsel for Kvamskogen,https://www.tv2.no/vaer/norge/hordaland-fylke/kvamskogen/I3U0c3IybmRmNDQwcCQxMzU3MTQ5OTk=?date=2026-07-20&warning=true,tv2.no,"... tilgjengelig. Kvamskogen . Pollenvarsel - gress. Skiheis, Kvam, Hordaland Fylke, Norge. Visning: Været nå. 20. juli. Klarvær. 18°. Føles som 16°. 2 (3) ...",2026-07-21,2026-07-20T10:59:37+00:00,https://aws15.tv2.no/weather/54/icons/weather-symbol/tv2/cloudy-light.svg,bonus,Google Alerts RSS,5,Kildescore 5 for tv2.no
Vil byggja ladestasjon på Jonshøgdi,https://www.hf.no/nyhende/vil-byggja-ladestasjon-pa-jonshogdi/380931,hf.no,Selskapet meiner at ladestasjonen vil styrkja Kvamskogen som trafikknutepunkt og leggja til rette for elektrifisering av tungtransporten. Tiltaket ...,2026-07-21,2026-07-20T08:36:34+00:00,https://image.hf.no/380938.jpg?imageId=380938&x=0&y=0&cropw=100&croph=100&panox=0&panoy=0&panow=100&panoh=100&width=1200&height=683,core,Google Alerts RSS,5,Kildescore 5 for hf.no
Vil verna meir av Kvamskogen,https://news.google.com/rss/articles/CBMidEFVX3lxTE5tOEstYmczRjJyYUJzTFRGX0I1VVRkTndhcFpKcjBCdGVRTHBMR21iU1VLVWw1N0hnRFU5NHhPeFYwWG9HUUsxNjlNR2xyOV81eFNJWEhhcWpqbDJqTWprajI2bkNkSVZoSW1vbGRjVzdKeFFG?oc=5,hf.no,Vil verna meir av Kvamskogen Hordaland Folkeblad,2026-07-21,2026-07-17T13:45:45+00:00,,core,Google News RSS,5,Kildescore 5 for hf.no
Vil prioritera gjennomføring av prosjektet som får godkjend reguleringsplan først,https://www.hardanger-folkeblad.no/vil-prioritera-gjennomforing-av-prosjektet-som-far-godkjend-reguleringsplan-forst/s/80-22-19875,hf.no,Kvamskogen: Fylket vil ha fart på dei to rassikringsprosjekta på fylkesveg 49 — men kva av dei kjem først i køen?,2026-07-21,2026-05-11T00:00:00+00:00,https://g.acdn.no/obscura/API/dynamic/r1/cue/tr_2000_2000_s_f/1778143074000/harfol/2026/5/7/8/rundkB8yring%2520austrepollen.png?chk=2405AC,core,HF fallback,7,"Kildescore 5 for hf.no; Temaord: reguleringsplan, veg"
(+) Planlegg hurtiglading på Kvamskogen,https://news.google.com/rss/articles/CBMieEFVX3lxTFBFNDRaZzZabWVMTDJ1ZjJJVHV3bnEtRjQzdC1LZXhBQkRmQkxxWFlGRy1Ia29MeVJyX0JMZ3YzaE43aXJPZXJlY0NaUzRIMTJwTkdJMzdOWlJtUEljYlhRUjZLdEpzWDl3VmNyQ1dCTUx3U1FTTVBRYg?oc=5,hf.no,(+) Planlegg hurtiglading på Kvamskogen Hordaland Folkeblad,2026-07-21,2026-05-02T07:00:00+00:00,,core,Google News RSS,5,Kildescore 5 for hf.no
Vil dela ut 450 000 frå fond,https://www.hf.no/nyhende/vil-dela-ut-450-000-fra-fond/370211,hf.no,"Den største tilrådde løyvinga går til Kvamskogen Vel, som har søkt om og ser ut til å få 150 000 kroner til vidare arbeid med låglandsløypa på Kvamskogen.",2026-07-21,2026-05-02T00:00:00+00:00,,core,HF fallback,7,"Kildescore 5 for hf.no; Temaord: Kvamskogen Vel, fond"
Vil verna meir av Kvamskogen,https://www.hf.no/nyhende/krev-strengare-vern-pa-kvamskogen/378629,hf.no,Vil verna meir av Kvamskogen,2026-07-21,,,core,Hordaland Folkeblad forside,5,Kildescore 5 for hf.no
